{
  "format": "alfred.workflow-template",
  "schemaVersion": 1,
  "minAlfredVersion": "1.0.0",
  "title": "Canonical boundaries 🌍",
  "description": "Defaults, exponents, and astral Unicode use shared bytes.",
  "graph": {
    "nodes": [
      { "id": "input", "type": "input", "data": { "label": "Input", "prompt": "Ready" }, "position": { "x": 100000000000000000000, "y": 0.0000001 } }
    ],
    "edges": []
  },
  "parameters": [
    { "key": "workingDirectory", "label": "Folder", "kind": "folder", "required": false, "target": { "kind": "workingDirectory", "nodeId": null, "field": "workingDirectory" } }
  ],
  "requirements": [],
  "starts": []
}
